"","component","entities","avg.subscriberCount","cooRshare_ratio.avg","cooRscore.avg","pageAdminTopCountry","facebook_page","facebook_group","facebook_profile","unique.full_domain","unique.parent_domain","newsguard.parent_domain.score","newsguard.parent_domain.rated","newsguard.parent_domain.prop","gini.full_domain","gini.parent_domain","top.full_domain","top.parent_domain"
"1",1,172,6856.70930232558,0.302898682195301,6.8710143506684,"NA",9,163,0,285,265,19.3988226637233,56,0.211320754716981,0.754980016089283,0.75777608359204,"www.facebook.com, magazin1.sk, youtube.com, t.me, www.youtube.com, cz24.news, www.parlamentnilisty.cz, www.infovojna.bz, slobodne-spravy.cc, rumble.com, bit.ly, www.koalafeed.com, aeronet.news, www.novinky.cz, www.plenum.sk, www.seznamzpravy.cz, protiproud.info, ereport.sk, janklan.cz, www.hlavnydennik.sk, vasespravy.com, cnn.iprima.cz, aktax.cz, www.idnes.cz, slovanskenebe.com, slovenskoaktualne.sk, veci-verejne.sk, www.dailymail.co.uk, archa21.sk, www.geopolitan.net, www.mintpressnews.com, www.ta3.com, slobodnyvysielac.sk, www.trend.sk, www.tydenikobcanskepravo.cz, picuscapital.sk, sho.sk, www.podtatransky-kurier.sk, www.infokuryr.cz, corrierefiorentino.corriere.it, www.badatel.net, cz.sputniknews.com, tn.nova.cz, www.telegraph.co.uk, variety.com, www.napalete.sk, oral.sk, echo24.cz, www.extraplus.sk, spravy.pravda.sk, www.ft.com, www.hlavnespravy.sk, m.lenta.ru, tadesco.org, www1.pluska.sk, vlkovobloguje.wordpress.com, www.startitup.sk, ceskezpravy.eu, dserver.bundestag.de, russiaun.ru, www.blogovisko.sk, arctic-russia.ru, fb.watch, tvnoviny.sk, www.e15.cz, www.heise.de, eurozpravy.cz, m.kievvlast.com.ua, mainland.press, www.forum24.cz, www.lidovky.cz, diem25.sk, tass.ru, ua.usembassy.gov, uncutnews.ch, www.mojevideo.sk, dennikn.sk, raptor-tv.cz, www.dostojneslovensko.eu, www.mirror.co.uk, ct24.ceskatelevize.cz, greekcitytimes.com, pravda24.cz, www.arfa.cz, russian.rt.com, www.blesk.cz, www.info.sk, www.pokec24.cz, www.svobodny-vysilac.cz, www.un.org, www.webnoviny.sk, kresadlo.com, rikaerika.blog.pravda.sk, twitter.com, vm.tiktok.com, www.cas.sk, www.kommersant.ru, www.msn.com, www.protiproud.info, www.prvnizpravy.cz, www.rtvs.sk, www.wsj.com, dennikstandard.sk, halturnerradioshow.com, skspravy.sk, swprs.org, vk.com, www.mimoriadnespravy.sk, www.netky.sk, www.rukojmi.cz, ekonomika.pravda.sk, hnonline.sk, pavolslota.blog.pravda.sk, www.lantidiplomatico.it, www.wsws.org, informacnavojna.tk, iprima.tv, radiosvstudiotapinradio, realrawnews.com, rusreinfo.ru, tradingeconomics.com, www.aktuality.sk, www.christianitas.sk, www.kurzy.cz, www.protiproud.cz, www.reformy.cz, www.vidlakovykydy.cz, en.royanews.tv, finweb.hnonline.sk, report24.news, slovenske-spravy.blogspot.com, spravy.rtvs.sk, www.lukaslhotan.cz, www.sana.sy, www.securitymagazin.cz, www.topky.sk, akw.sk, dilyana-bg.translate.goog, dl.wish.com, duma.gov.ru, en.kremlin.ru, fontech.startitup.sk, peoplesdispatch.org, plus7dni.pluska.sk, www.irozhlas.cz, www.nastvanematky.cz, www.proinvestory.cz, www.reuters.com, www.sport.cz, www.stereogum.com, www.teraz.sk, www.vipnoviny.cz, plus.rozhlas.cz, techsvet.cz, www.amnesty.org.uk, www.blick.ch, www.prahain.cz, youi.cz, a.msn.com, bajecnezeny.sk, blogger.googleusercontent.com, dennikpolitika.sk, english.nv.ua, klucod.sk, knihya.cz, militarywatchmagazine.com, newspunch.com, operationdisclosureofficial.com, pravdaovode.cz, thegrayzone.com, unser-mitteleuropa.com, www.bz-berlin.de, www.ctidoma.cz, www.michalapetr.com, www.politico.eu, www.sds.cz, www.thegatewaypundit.com, www.theigmp.org, asiatimes.com, bezpressu.news, blog.hlavnespravy.sk, en.people.cn, en.wikipedia.org, eu.usatoday.com, iz.ru, koktejl.azet.sk, m.topky.sk, media1.tenor.co, nocomment.sk, politikus.info, prehrajto.cz, riseearth.org, www.ac24.cz, www.bbc.com, www.infovojna.sk, www.litterate.cz, www.narodninoviny.cz, www.nytimes.com, www.pbs.org, www.postoj.sk, www.redvoicemedia.com, www.ukrinform.net, www.welt.de, aeronet.cz, aktualnesk.blogspot.com, albicla.com, beliana.sav.sk, buymeacoffee.com, casopisargument.cz, cnn.it, consortiumnews.com, czch.tv, dilyana.bg, dnes.zivot.org, docs.google.com, e-republika.cz, english.alarabiya.net, eurovision.lnk.to, foreignpolicy.com, gloria.tv, greatgameindia.com, hlavnenoviny.com, iltirreno.gelocal.it, informnapalm.org, meduza-io.translate.goog, novysmer.cz, ok.ru, paralelne.cz, parlamentnilisty.cz, pravdive.eu, slovenskespravy.sk, sowa, spravodlivy.blog.pravda.sk, svetkrestanstva.postoj.sk, t.co, tadesco.blogspot.com, tadyclanek92.fun, thehill.com, themartialman.com, vimeo.com, vz.ru, www-bbc-com.translate.goog, www.40plus.sk, www.armyrecognition.com, www.arte.tv, www.bloomberg.com, www.bpb.de, www.bratzabrata.sk, www.ceskenoviny.cz, www.congress.gov, www.denik.cz, www.deutschlandfunk.de, www.fxstreet.com, www.gentside.de, www.informacnavojna.tk, www.inlibri.online, www.jpost.com, www.mearsheimer.com, www.narodni-noviny.cz, www.newsweek.com, www.parlamentnelisty.sk, www.patreon.com, www.paulcraigroberts.org, www.skrytapravda.cz, www.spectator.co.uk, www.srbijadanas.com, www.vaclavrehak.cz, www.washingtonpost.com, www.zerohedge.com, zemavek.sk, zen.yandex.ru, zivotvcesku.cz, zvtv.sk, buff.ly, debata.pravda.sk, denikn.cz, liveuamap.com, tass.com, veljkorigaa1.blogspot.com, violinistssupportukraine.com, www.berliner-zeitung.de, www.dnes24.sk, www.focus.de, www.simonparkes.org, www1.wdr.de","youtube.com, facebook.com, magazin1.sk, t.me, cz24.news, parlamentnilisty.cz, infovojna.bz, slobodne-spravy.cc, rumble.com, bit.ly, koalafeed.com, aeronet.news, novinky.cz, protiproud.info, plenum.sk, seznamzpravy.cz, ereport.sk, janklan.cz, hlavnydennik.sk, vasespravy.com, iprima.cz, aktax.cz, idnes.cz, pravda.sk, slovanskenebe.com, slovenskoaktualne.sk, dailymail.co.uk, veci-verejne.sk, archa21.sk, geopolitan.net, mintpressnews.com, ta3.com, slobodnyvysielac.sk, trend.sk, tydenikobcanskepravo.cz, picuscapital.sk, podtatransky-kurier.sk, sho.sk, infokuryr.cz, badatel.net, corriere.it, nova.cz, sputniknews.com, pluska.sk, telegraph.co.uk, startitup.sk, variety.com, hlavnespravy.sk, napalete.sk, oral.sk, echo24.cz, extraplus.sk, ft.com, lenta.ru, tadesco.org, wordpress.com, bundestag.de, ceskezpravy.eu, russiaun.ru, blogovisko.sk, rtvs.sk, arctic-russia.ru, e15.cz, fb.watch, heise.de, tvnoviny.sk, eurozpravy.cz, forum24.cz, hnonline.sk, kievvlast.com.ua, lidovky.cz, mainland.press, diem25.sk, mojevideo.sk, msn.com, tass.ru, uncutnews.ch, usembassy.gov, dennikn.sk, dostojneslovensko.eu, mirror.co.uk, raptor-tv.cz, arfa.cz, ceskatelevize.cz, greekcitytimes.com, pravda24.cz, blesk.cz, info.sk, pokec24.cz, rt.com, svobodny-vysilac.cz, un.org, webnoviny.sk, cas.sk, kommersant.ru, kresadlo.com, prvnizpravy.cz, tiktok.com, twitter.com, wsj.com, dennikstandard.sk, halturnerradioshow.com, informacnavojna.tk, mimoriadnespravy.sk, NA.NA, netky.sk, rukojmi.cz, skspravy.sk, swprs.org, topky.sk, translate.goog, vk.com, lantidiplomatico.it, wsws.org, aktuality.sk, christianitas.sk, iprima.tv, kurzy.cz, protiproud.cz, realrawnews.com, reformy.cz, rusreinfo.ru, tradingeconomics.com, vidlakovykydy.cz, lukaslhotan.cz, report24.news, royanews.tv, sana.sy, securitymagazin.cz, slovenske-spravy.blogspot.com, akw.sk, duma.gov.ru, irozhlas.cz, kremlin.ru, nastvanematky.cz, peoplesdispatch.org, proinvestory.cz, reuters.com, sport.cz, stereogum.com, teraz.sk, vipnoviny.cz, wish.com, amnesty.org.uk, blick.ch, postoj.sk, prahain.cz, rozhlas.cz, techsvet.cz, youi.cz, bajecnezeny.sk, bz-berlin.de, ctidoma.cz, dennikpolitika.sk, googleusercontent.com, klucod.sk, knihya.cz, michalapetr.com, militarywatchmagazine.com, newspunch.com, nv.ua, operationdisclosureofficial.com, politico.eu, pravdaovode.cz, sds.cz, thegatewaypundit.com, thegrayzone.com, theigmp.org, unser-mitteleuropa.com, ac24.cz, asiatimes.com, azet.sk, bbc.com, bezpressu.news, infovojna.sk, iz.ru, litterate.cz, narodninoviny.cz, nocomment.sk, nytimes.com, pbs.org, people.cn, politikus.info, prehrajto.cz, redvoicemedia.com, riseearth.org, tenor.co, ukrinform.net, usatoday.com, welt.de, wikipedia.org, 40plus.sk, aeronet.cz, aktualnesk.blogspot.com, alarabiya.net, albicla.com, armyrecognition.com, arte.tv, bloomberg.com, bpb.de, bratzabrata.sk, buymeacoffee.com, casopisargument.cz, ceskenoviny.cz, cnn.it, congress.gov, consortiumnews.com, czch.tv, denik.cz, deutschlandfunk.de, dilyana.bg, e-republika.cz, foreignpolicy.com, fxstreet.com, gelocal.it, gentside.de, gloria.tv, google.com, greatgameindia.com, hlavnenoviny.com, informnapalm.org, inlibri.online, jpost.com, lnk.to, mearsheimer.com, narodni-noviny.cz, newsweek.com, novysmer.cz, ok.ru, paralelne.cz, parlamentnelisty.sk, patreon.com, paulcraigroberts.org, pravdive.eu, sav.sk, skrytapravda.cz, slovenskespravy.sk, spectator.co.uk, srbijadanas.com, t.co, tadesco.blogspot.com, tadyclanek92.fun, thehill.com, themartialman.com, vaclavrehak.cz, vimeo.com, vz.ru, washingtonpost.com, yandex.ru, zemavek.sk, zerohedge.com, zivot.org, zivotvcesku.cz, zvtv.sk, berliner-zeitung.de, buff.ly, denikn.cz, dnes24.sk, focus.de, liveuamap.com, simonparkes.org, tass.com, veljkorigaa1.blogspot.com, violinistssupportukraine.com, wdr.de"
"2",2,6,6952,0.340829478287063,4.56944444444444,"NA",0,6,0,9,8,4,2,0.25,0.695833333333333,0.738095238095238,"vm.tiktok.com, www.youtube.com, youtube.com, www.instagram.com, www.facebook.com, www.money.pl, www.newsweek.pl, www.washingtonpost.com, zrzutka.pl","tiktok.com, youtube.com, instagram.com, facebook.com, money.pl, newsweek.pl, washingtonpost.com, zrzutka.pl"
"3",3,40,31660.325,0.312041215550304,6.26210581085581,"NA",15,25,0,70,68,2.77165354330709,7,0.102941176470588,0.767259449590912,0.781017153733665,"pressmania.pl, youtube.com, www.facebook.com, prostozmostu.net, www.youtube.com, banbye.com, resetobywatelski.pl, www.newsweek.pl, wrealu24.tv, ngopole.pl, rumble.com, wiadomo.co, medianarodowe.com, wiadomosci.onet.pl, www.tysol.pl, tvn24.pl, wiadomosci.gazeta.pl, wiadomosci.wp.pl, zrzutka.pl, gospodarka.dziennik.pl, tofakty.pl, www.onet.pl, www.polsatnews.pl, www.rzeszowskieinfo.pl, alexjones.pl, bit.ly, globalna.info, gloria.tv, ipolska24.pl, seemorerocks.is, instagram.com, lovecatsworld.com, miziaforum.com, natemat.pl, newsweek.pl,, niezaleznagroup.wordpress.com, pomagam.pl, radiomaryja.news, t.co, trendsinthenews.substack.com, tvrepublika.pl, uuarc.org, wprawo.pl, www.amnesty.org.uk, www.anews.com.tr, www.kontrowersje.net, www.tokfm.pl, www.tvp.info, wyborcza.pl, annointedhands.myshopify.com, belsat.eu, corona-transition.org, crowdmedia.pl, english.almayadeen.net, grrrgraphics.com, idzpodprad.pl, oko.press, silesia24.pl, sun9-45.userapi.com, trib.al, tygodnikbydgoski.pl, www.airteamimages.com, www.bbn.gov.pl, www.corriere.it, www.euronews.com, www.forbes.com, www.interfax.ru, www.jpost.com, www.money.pl, www.reddit.com","pressmania.pl, youtube.com, facebook.com, prostozmostu.net, banbye.com, resetobywatelski.pl, newsweek.pl, onet.pl, wrealu24.tv, ngopole.pl, rumble.com, wiadomo.co, medianarodowe.com, tysol.pl, gazeta.pl, tvn24.pl, wp.pl, zrzutka.pl, dziennik.pl, polsatnews.pl, rzeszowskieinfo.pl, tofakty.pl, alexjones.pl, bit.ly, globalna.info, gloria.tv, ipolska24.pl, seemorerocks.is, amnesty.org.uk, anews.com.tr, instagram.com, kontrowersje.net, lovecatsworld.com, miziaforum.com, NA.NA, natemat.pl, pomagam.pl, radiomaryja.news, substack.com, t.co, tokfm.pl, tvp.info, tvrepublika.pl, uuarc.org, wordpress.com, wprawo.pl, wyborcza.pl, airteamimages.com, almayadeen.net, bbn.gov.pl, belsat.eu, corona-transition.org, corriere.it, crowdmedia.pl, euronews.com, forbes.com, grrrgraphics.com, idzpodprad.pl, interfax.ru, jpost.com, money.pl, myshopify.com, oko.press, reddit.com, silesia24.pl, trib.al, tygodnikbydgoski.pl, userapi.com"
"4",4,16,6930,0.170190337193443,6.72395833333333,"NA",0,16,0,19,18,0.021551724137931,2,0.111111111111111,0.886868686868686,0.904171122994652,"www.youtube.com, youtube.com, tiny.pl, www.facebook.com, wprawo.pl, vm.tiktok.com, grrrgraphics.com, fronda.pl, wydarzenia.interia.pl, gloria.tv, stopworldcontrol-com.translate.goog, t.co, wiadomosci.radiozet.pl, www.activistpost.com, www.airteamimages.com, www.bbn.gov.pl, www.kuprawdzie.pl, www.onet.pl, zrzutka.pl","youtube.com, tiny.pl, facebook.com, wprawo.pl, tiktok.com, grrrgraphics.com, fronda.pl, interia.pl, activistpost.com, airteamimages.com, bbn.gov.pl, gloria.tv, kuprawdzie.pl, onet.pl, radiozet.pl, t.co, translate.goog, zrzutka.pl"
"5",5,216,12573.9861111111,0.303665246813809,6.64369659739613,"NA",1,215,0,348,312,22.2636510500808,140,0.448717948717949,0.781963546914397,0.791169404560014,"youtube.com, www.donbass-insider.com, www.facebook.com, russiepolitics.blogspot.com, www.youtube.com, t.me, twitter.com, lemediaen442.fr, www.lemonde.fr, reseauinternational.net, www.droits-libertes.be, vm.tiktok.com, rumble.com, pic.twitter.com, lecourrierdesstrateges.fr, www.bfmtv.com, www.wsws.org, lesakerfrancophone.fr, fb.watch, brigittebouzonnie.substack.com, www.lefigaro.fr, agora24agency.com, www.francetvinfo.fr, vk.com, www.ouest-france.fr, www.francesoir.fr, www.20minutes.fr, www.tvlibertes.com, www.cnews.fr, baslesmasques.com, bit.ly, www.zerohedge.com, lecourrier-du-soir.com, www.investigaction.net, geopragma.fr, ift.tt, planetes360.fr, francais.rt.com, arretsurinfo.ch, sonar21.com, www.courrierinternational.com, dons.debout-la-france.fr, france.attac.org, www.rt.com, t.co, www.profession-gendarme.com, brunobertez.com, solidariteetprogres.fr, www.vestidinrusia.ro, insideevs.fr, profidecatholica.com, elcomunista.net, alawata-rebellion.blogspot.com, kremlin.ru, histoireetsociete.com, www.apar.tv, www.minurne.org, artsakh.news, russiepolitics.com, www.lesechos.fr, www.marianne.net, 2022nda.fr, jacquescheminade.fr, my.mtr.cool, sputniknews.com, www.jeremie-mercier.com, www.msn.com, www.upr.fr, exoconscience.com, france.mid.ru, infosdanyfr.wordpress.com, katehon.com, rtfrance, www.mesopinions.com, www.nti.org, asiatimes.com, crowdbunker.com, fr.euronews.com, horizons, juste-milieu.fr, latableronde.over-blog.com, mobile.twitter.com, news-24.fr, pgibertie.com, ria.ru, uneek24media.wordpress.com, vz.ru, www.franceinter.fr, www.lexpress.fr, -209109800-la-fin-des-faux-semblants, cogiito.com, i24ne.ws, idrissaberkane.org, lemediatv.fr, m.epochtimes.fr, myjournal.fr, stratpol.com, tass.ru, www.france.tv, www.gala.fr, www.ladepeche.fr, www.resumenlatinoamericano.org, www.reuters.com, www.rtbf.be, anthonyjoubertpro, aphadolie.com, c.leprogres.fr, donbassinsider, en.m.wikipedia.org, francesoir.fr, giletsjaunesbrestois.home.blog, mediazone.zonefr.com, new-africa.org, pbs.twimg.com, rusreinfo.ru, sansapriori.net, themoscowtimes.com, vimeo.com, www.instagram.com, www.latribune.fr, www.legrandsoir.info, www.letribunaldunet.fr, www.lifesitenews.com, www.paypal.me, www.tf1info.fr, desintoxmelenchon.fr, disclose.ngo, france.pravda.ru, gettr.com, images.app.goo.gl, lemediaen442.payrexx.com, lenta.ru, manipulationmondiale.blogspot.com, ripostelaique.com, utip.io, www.bloomberg.com, www.bvoltaire.fr, www.i24news.tv, www.infovf.com, www.jeune-independant.net, www.lepoint.fr, www.liberation.fr, www.politis.fr, boriskarpov.tvs24.ru, fr.sott.net, fr.sputniknews.africa, fr.sputniknews.com, french.presstv.ir, lemediapourtous.fr, lescorpscelestes.fr, mobile.francetvinfo.fr, news.antiwar.com, nice-provence.info, rmc.bfmtv.com, sana.sy, stratpol, www.aljazeera.com, www.asafrance.fr, www.boursorama.com, www.breaking7.com, www.christianpost.com, www.europe1.fr, www.newsweek.com, www.nexus.fr, www.revueconflits.com, www.sudouest.fr, www.tvl.fr, www.ulusal.com.tr, www.valeursactuelles.com, www.voltairenet.org, www.weforum.org, actu.orange.fr, aspi.com.ua, deslivresetnous769849013.wordpress.com, fb.me, guyboulianne.com, linsoumission.fr, livrenoir.fr, melenchon.fr, multinationales.org, streamyard.com, www.contrepoints.org, www.dailymotion.com, www.leslignesbougent.org, www.monde-diplomatique.fr, www.radiofrance.fr, www.vududroit.com, 09novembre1989.revolublog.com, anchor.fm, ansm.sante.fr, asiafinancial.com, avia-pro.fr, avia.pro, bfmtv.com, bigleaguepolitics.com, buff.ly, businessbourse.com, cadtm.org, cf2r.org, childrenshealthdefense.org, crechetalo.com, dlvr.it, en.mehrnews.com, espanol.almayadeen.net, foreignpolicy.com, fr.aleteia.org, fr.tipeee.com, fr.topwar.ru, france3-regions.francetvinfo.fr, french.almanar.com, groups.google.com, healthimpactnews.com, helenerichardfavre.ch, igot_u7, infoscope.live, insurgente.org, journals.openedition.org, ko-fi.com, l.francebleu.fr, labrousse-erick.over-blog.com, les7duquebec.net, lesdeqodeurs.fr, lesmoutonsenrages.fr, lesobservateurs.ch, libertarianinstitute.org, libremedia.ca, m.facebook.com, magazine.nexus.fr, mensongesdetats.wordpress.com, mid.ru, mysonhunter.com, news.rambler.ru, oursmagazine.fr, paypal.me, putsch.media, rapportsdeforce.fr, rebellion-sre.fr, resistancerepublicaine.com, rfi.my, russian.rt.com, theatrum-belli.com, thepostmillennial.com, tipeee.com, trends.levif.be, tvl.fr, ua.usembassy.gov, vivresainement, vl-media.fr, w.lpnt.fr, www.7sur7.be, www.agoravox.fr, www.amnesty.fr, www.businessbourse.com, www.cath.ch, www.challenges.fr, www.dailymail.co.uk, www.dissidentofficiel.com, www.epochtimes.fr, www.ericzemmour.org, www.europe-israel.org, www.forbes.com, www.ft.com, www.gaucherepublicaine.org, www.gbnews.uk, www.haaretz.com, www.idecrypte.eu, www.ina.fr, www.infovojna.bz, www.initiative-communiste.fr, www.inquirer.com, www.kp.ru, www.laboursolidarity.org, www.lalibre.be, www.laselectiondujour.com, www.leparisien.fr, www.lesalonbeige.fr, www.m24.ru, www.midilibre.fr, www.mirror.co.uk, www.naturalblaze.com, www.nesto.ca, www.nytimes.com, www.pardem.org, www.pcq.qc.ca, www.publicsenat.fr, www.tahiti-infos.com, www.telesurtv.net, www.thesun.co.uk, www.transportinfo.fr, www.zejournal.mobi, www.zinfos974.com, zejournal.mobi, zerohedge.com, aeronet.news, amg-news.com, basta.media, bellaciao.org, buonacausa.org, consortiumnews.com, dailyexpose.uk, decrypt.co, dontpay.uk, drive.google.com, ensemble-insoumise.org, eric-et-le-pg.over-blog.fr, evenement.avecvous.fr, fr.timesofisrael.com, go.byoblu.com, greekcitytimes.com, halturnerradioshow.com, iz-ru.translate.goog, kontrekulture.com, l-archipel-contre-attaque.over-blog.fr, lactudissidente.com, lafranceinsoumise.fr, lesmoutonsrebelles.com, m.huffingtonpost.fr, news-antiwar-com.translate.goog, republique5.fr, riseup.net, schillerinstitute.com, solidaires.org, thetruedefender.com, tinyurl.com, voxeurop.eu, www.caradisiac.com, www.casadellacivilta.com, www.change.org, www.cielvoile.fr, www.editoweb.eu, www.exclusif.net, www.humanite.fr, www.infomigrants.net, www.juristique.org, www.lelibrepenseur.org, www.lemediatv.fr, www.librinova.com, www.lindependant.fr, www.ln24.be, www.nachdenkseiten.de, www.newscientist.com, www.nouvelobs.com, www.public.fr, www.srbijajavlja.com, www.telegraph.co.uk, www.theguardian.com, www.touteleurope.eu, www.welt.de","youtube.com, donbass-insider.com, facebook.com, twitter.com, russiepolitics.blogspot.com, t.me, lemediaen442.fr, lemonde.fr, reseauinternational.net, droits-libertes.be, tiktok.com, rumble.com, bfmtv.com, lecourrierdesstrateges.fr, wsws.org, francetvinfo.fr, lesakerfrancophone.fr, NA.NA, rt.com, fb.watch, francesoir.fr, substack.com, lefigaro.fr, agora24agency.com, ouest-france.fr, vk.com, 20minutes.fr, tvlibertes.com, cnews.fr, baslesmasques.com, bit.ly, zerohedge.com, investigaction.net, lecourrier-du-soir.com, geopragma.fr, ift.tt, planetes360.fr, wordpress.com, arretsurinfo.ch, courrierinternational.com, sonar21.com, attac.org, debout-la-france.fr, profession-gendarme.com, t.co, brunobertez.com, solidariteetprogres.fr, vestidinrusia.ro, insideevs.fr, profidecatholica.com, elcomunista.net, alawata-rebellion.blogspot.com, kremlin.ru, sputniknews.com, apar.tv, histoireetsociete.com, minurne.org, artsakh.news, lesechos.fr, russiepolitics.com, marianne.net, mid.ru, 2022nda.fr, jacquescheminade.fr, jeremie-mercier.com, msn.com, mtr.cool, over-blog.com, upr.fr, epochtimes.fr, exoconscience.com, katehon.com, mesopinions.com, nti.org, asiatimes.com, crowdbunker.com, euronews.com, franceinter.fr, juste-milieu.fr, lemediatv.fr, lexpress.fr, news-24.fr, paypal.me, pgibertie.com, ria.ru, vz.ru, cogiito.com, france.tv, gala.fr, i24ne.ws, idrissaberkane.org, ladepeche.fr, myjournal.fr, resumenlatinoamericano.org, reuters.com, rtbf.be, stratpol.com, tass.ru, aphadolie.com, home.blog, instagram.com, latribune.fr, legrandsoir.info, leprogres.fr, letribunaldunet.fr, lifesitenews.com, new-africa.org, nexus.fr, rusreinfo.ru, sansapriori.net, tf1info.fr, themoscowtimes.com, tvl.fr, twimg.com, vimeo.com, wikipedia.org, zonefr.com, bloomberg.com, bvoltaire.fr, desintoxmelenchon.fr, disclose.ngo, gettr.com, goo.gl, i24news.tv, infovf.com, jeune-independant.net, lenta.ru, lepoint.fr, liberation.fr, manipulationmondiale.blogspot.com, payrexx.com, politis.fr, pravda.ru, ripostelaique.com, utip.io, aljazeera.com, antiwar.com, asafrance.fr, boursorama.com, breaking7.com, businessbourse.com, christianpost.com, europe1.fr, lemediapourtous.fr, lescorpscelestes.fr, newsweek.com, nice-provence.info, presstv.ir, revueconflits.com, sana.sy, sott.net, sputniknews.africa, sudouest.fr, tipeee.com, tvs24.ru, ulusal.com.tr, valeursactuelles.com, voltairenet.org, weforum.org, zejournal.mobi, aspi.com.ua, contrepoints.org, dailymotion.com, fb.me, google.com, guyboulianne.com, leslignesbougent.org, linsoumission.fr, livrenoir.fr, melenchon.fr, monde-diplomatique.fr, multinationales.org, orange.fr, radiofrance.fr, streamyard.com, vududroit.com, 7sur7.be, agoravox.fr, aleteia.org, almanar.com, almayadeen.net, amnesty.fr, anchor.fm, asiafinancial.com, avia-pro.fr, avia.pro, bigleaguepolitics.com, buff.ly, cadtm.org, cath.ch, cf2r.org, challenges.fr, childrenshealthdefense.org, crechetalo.com, dailymail.co.uk, dissidentofficiel.com, dlvr.it, ericzemmour.org, europe-israel.org, forbes.com, foreignpolicy.com, francebleu.fr, ft.com, gaucherepublicaine.org, gbnews.uk, haaretz.com, healthimpactnews.com, helenerichardfavre.ch, idecrypte.eu, ina.fr, infoscope.live, infovojna.bz, initiative-communiste.fr, inquirer.com, insurgente.org, ko-fi.com, kp.ru, laboursolidarity.org, lalibre.be, laselectiondujour.com, leparisien.fr, les7duquebec.net, lesalonbeige.fr, lesdeqodeurs.fr, lesmoutonsenrages.fr, lesobservateurs.ch, levif.be, libertarianinstitute.org, libremedia.ca, lpnt.fr, m24.ru, mehrnews.com, midilibre.fr, mirror.co.uk, mysonhunter.com, naturalblaze.com, nesto.ca, nytimes.com, openedition.org, oursmagazine.fr, over-blog.fr, pardem.org, pcq.qc.ca, publicsenat.fr, putsch.media, rambler.ru, rapportsdeforce.fr, rebellion-sre.fr, resistancerepublicaine.com, revolublog.com, rfi.my, sante.fr, tahiti-infos.com, telesurtv.net, theatrum-belli.com, thepostmillennial.com, thesun.co.uk, topwar.ru, translate.goog, transportinfo.fr, usembassy.gov, vl-media.fr, zinfos974.com, aeronet.news, amg-news.com, avecvous.fr, basta.media, bellaciao.org, buonacausa.org, byoblu.com, caradisiac.com, casadellacivilta.com, change.org, cielvoile.fr, consortiumnews.com, dailyexpose.uk, decrypt.co, dontpay.uk, editoweb.eu, ensemble-insoumise.org, exclusif.net, greekcitytimes.com, halturnerradioshow.com, huffingtonpost.fr, humanite.fr, infomigrants.net, juristique.org, kontrekulture.com, lactudissidente.com, lafranceinsoumise.fr, lelibrepenseur.org, lesmoutonsrebelles.com, librinova.com, lindependant.fr, ln24.be, nachdenkseiten.de, newscientist.com, nouvelobs.com, public.fr, republique5.fr, riseup.net, schillerinstitute.com, solidaires.org, srbijajavlja.com, telegraph.co.uk, theguardian.com, thetruedefender.com, timesofisrael.com, tinyurl.com, touteleurope.eu, voxeurop.eu, welt.de"
"6",6,14,16592.5714285714,0.304420869081225,16.2694444444444,"NA",2,12,0,16,15,1.5,2,0.133333333333333,0.881733746130031,0.876160990712074,"teleskop.hr, hrvatski-glasnik.com, www.maxportal.hr, dugopolje.org, epoha.com.hr, www.hop.com.hr, projektvelebit.com, www.facebook.com, www.youtube.com, youtube.com, za-dom.com, expose-news.com, hrvatskidnevnik.com, hrvatskonebo.org, priznajem.hr, www.index.hr","teleskop.hr, hrvatski-glasnik.com, maxportal.hr, dugopolje.org, epoha.com.hr, hop.com.hr, youtube.com, facebook.com, projektvelebit.com, za-dom.com, expose-news.com, hrvatskidnevnik.com, hrvatskonebo.org, index.hr, priznajem.hr"
"7",7,4,6350,0.393055555555556,6,"NA",0,4,0,4,4,0,1,0.25,0.909090909090909,0.909090909090909,"youtube.com, checkout.gazetadopovo.com.br, nelsonfrancojobim.blogspot.com, www.facebook.com","youtube.com, facebook.com, gazetadopovo.com.br, nelsonfrancojobim.blogspot.com"
