"","component","entities","avg.subscriberCount","cooRshare_ratio.avg","cooRscore.avg","pageAdminTopCountry","facebook_page","facebook_group","facebook_profile","unique.full_domain","unique.parent_domain","newsguard.parent_domain.score","newsguard.parent_domain.rated","newsguard.parent_domain.prop","gini.full_domain","gini.parent_domain","top.full_domain","top.parent_domain"
"51",51,9,22587.7777777778,0.366346272169804,6.75873015873016,"NA",0,9,0,32,30,56.9047619047619,13,0.433333333333333,0.781267685342388,0.792800967937084,"ozakago.blog.jp, www.timesofisrael.com, youtube.com, twitter.com, www.youtube.com, jp2day.net, t.me, www.reuters.com, amgreatness.com, bit.ly, kremlin.ru, abcn.ws, econ.st, on.ft.com, trib.al, www.afpbb.com, www.newsweekjapan.jp, www.thegatewaypundit.com, www.thetimes.co.uk, corona-transition.org, mid.ru, news.yahoo.co.jp, news22.net, newsinfo.inquirer.net, nypost.com, thenationalpulse.com, threadreaderapp.com, ukraine-now.hatenablog.com, www.dailywire.com, www.ft.com, www.nippon.com, www.nti.org","blog.jp, youtube.com, timesofisrael.com, twitter.com, jp2day.net, reuters.com, t.me, amgreatness.com, bit.ly, ft.com, kremlin.ru, abcn.ws, afpbb.com, econ.st, newsweekjapan.jp, thegatewaypundit.com, thetimes.co.uk, trib.al, corona-transition.org, dailywire.com, hatenablog.com, inquirer.net, mid.ru, news22.net, nippon.com, nti.org, nypost.com, thenationalpulse.com, threadreaderapp.com, yahoo.co.jp"
"52",52,3,3345.33333333333,0.348333333333333,5.33333333333333,"NA",0,3,0,6,6,40.7619047619048,6,1,0.371428571428571,0.371428571428571,"www.thegatewaypundit.com, youtube.com, nypost.com, www.cnbc.com, rumble.com, www.usatoday.com","thegatewaypundit.com, youtube.com, cnbc.com, nypost.com, rumble.com, usatoday.com"
"53",53,3,3309.33333333333,0.357298474945534,4.33333333333333,"NA",0,3,0,3,3,0,2,0.666666666666667,0.666666666666666,0.666666666666666,"rumble.com, www.facebook.com, youtube.com","rumble.com, facebook.com, youtube.com"
"54",54,2,3326.5,0.363970588235294,4,"NA",0,2,0,5,5,2.5,3,0.6,0.458333333333333,0.458333333333333,"youtube.com, cousints.com, rumble.com, secure.anedot.com, www.newsmax.com","youtube.com, cousints.com, rumble.com, anedot.com, newsmax.com"
"55",55,3,285634,0.375274725274725,4.5,"NA",0,3,0,16,16,0,1,0.0625,0.479365079365079,0.479365079365079,"doseco.cd, youtube.com, www.facebook.com, t.me, rfi.my, www.radiotelesilo.fr, afriquewide.net, artetsecurite.wordpress.com, bit.ly, fb.watch, lesvolcansnews.net, levillageois.info, newscd.net, proocom-news.blogspot.com, www.france.tv, www.hapamedia.net","doseco.cd, youtube.com, facebook.com, t.me, radiotelesilo.fr, rfi.my, afriquewide.net, bit.ly, fb.watch, france.tv, hapamedia.net, lesvolcansnews.net, levillageois.info, newscd.net, proocom-news.blogspot.com, wordpress.com"
"56",56,3,50713,0.385666666666667,9,"NA",1,2,0,8,7,19.1489361702128,2,0.285714285714286,0.673101673101673,0.723723723723724,"velhogeneral.com.br, www.youtube.com, youtube.com, www.nytimes.com, cpd.gov.ua, t.co, www.facebook.com, www.wwf.org.br","velhogeneral.com.br, youtube.com, nytimes.com, cpd.gov.ua, facebook.com, t.co, wwf.org.br"
"57",57,3,14906,0.47037037037037,4.33333333333333,"NA",0,3,0,5,5,14.2857142857143,2,0.4,0.323529411764706,0.323529411764706,"youtube.com, www.change.org, m.vk.com, t.me, www.washingtonpost.com","youtube.com, change.org, t.me, vk.com, washingtonpost.com"
"58",58,3,21071.6666666667,0.258681895354221,4.5,"NA",0,3,0,10,10,78.2631578947368,9,0.9,0.233333333333333,0.233333333333333,"www.politico.com, www.theatlantic.com, youtube.com, abcn.ws, apnews.com, www.bloomberg.com, www.cnn.com, www.businessinsider.com, www.facebook.com, www.westernjournal.com","politico.com, theatlantic.com, youtube.com, abcn.ws, apnews.com, bloomberg.com, cnn.com, businessinsider.com, facebook.com, westernjournal.com"
"59",59,2,7236,0.144091766184789,4,"NA",0,2,0,7,7,8.40625,6,0.857142857142857,0.313725490196078,0.313725490196078,"rumble.com, youtube.com, www.donbass-insider.com, realrawnews.com, www.bitchute.com, en.kremlin.ru, www.westernjournal.com","rumble.com, youtube.com, donbass-insider.com, bitchute.com, realrawnews.com, kremlin.ru, westernjournal.com"
"60",60,2,18290.5,0.408333333333333,4,"NA",0,2,0,3,3,0,1,0.333333333333333,0.545454545454545,0.545454545454545,"youtube.com, www.facebook.com, t.me","youtube.com, facebook.com, t.me"
"61",61,2,28945.5,0.313701923076923,4,"NA",0,2,0,8,8,13.2142857142857,3,0.375,0.333333333333333,0.333333333333333,"mundo.sputniknews.com, vaki.co, www.facebook.com, jpmas.com.ni, youtube.com, actualidad.rt.com, bit.ly, hackerfiscalia.substack.com","sputniknews.com, vaki.co, facebook.com, jpmas.com.ni, youtube.com, bit.ly, rt.com, substack.com"
"62",62,2,26225.5,0.234322033898305,6,"NA",0,2,0,2,2,0,1,0.5,0.857142857142857,0.857142857142857,"youtube.com, www.facebook.com","youtube.com, facebook.com"
"63",63,4,69841.75,0.330939001178283,4,"NA",0,4,0,9,9,16,2,0.222222222222222,0.588709677419355,0.588709677419355,"www.facebook.com, vaki.co, youtube.com, t.co, cnn.it, fb.watch, prendetv.smart.link, twitter.com, www.jornada.com.mx","facebook.com, vaki.co, youtube.com, t.co, cnn.it, fb.watch, jornada.com.mx, smart.link, twitter.com"
"64",64,3,2039,0.271394350134508,6,"NA",0,3,0,18,18,15.8653846153846,8,0.444444444444444,0.448529411764706,0.448529411764706,"www.rt.com, rumble.com, celiafarber.substack.com, whatsupcanada.org, www.breaking7.com, youtube.com, amg-news.com, mavericknews.ca, munkdebates.com, tnc.news, anonymousoffcircuitsec.data.blog, dailyexpose.uk, expose-news.com, www.ctvnews.ca, www.google.com, www.nationalcitizensalliance.ca, www.podbean.com, www.theepochtimes.com","rt.com, rumble.com, breaking7.com, substack.com, whatsupcanada.org, youtube.com, amg-news.com, mavericknews.ca, munkdebates.com, tnc.news, ctvnews.ca, dailyexpose.uk, data.blog, expose-news.com, google.com, nationalcitizensalliance.ca, podbean.com, theepochtimes.com"
"65",65,2,8016.5,0.224137931034483,4,"NA",0,2,0,16,15,43.7894736842105,8,0.533333333333333,0.314942528735632,0.334975369458128,"www.foxnews.com, youtube.com, mronline.org, ottawacitizen.com, ottawasun.com, t.me, www.facebook.com, www.zerohedge.com, rumble.com, thegrayzone.com, twitter.com, www.albertainstitute.ca, www.freedomforumcanada.com, www.nationalcitizensalliance.ca, www.rt.com, www.youtube.com","foxnews.com, youtube.com, facebook.com, mronline.org, ottawacitizen.com, ottawasun.com, t.me, zerohedge.com, albertainstitute.ca, freedomforumcanada.com, nationalcitizensalliance.ca, rt.com, rumble.com, thegrayzone.com, twitter.com"
"66",66,2,2381,0.226388888888889,4,"NA",0,2,0,11,10,44.375,6,0.6,0.352380952380952,0.428571428571429,"www.facebook.com, www.youtube.com, youtube.com, melenchon2022.fr, www.politis.fr, basta.media, kaizen-magazine.com, multinationales.org, rmc.bfmtv.com, www.francetvinfo.fr, www.reuters.com","youtube.com, facebook.com, melenchon2022.fr, politis.fr, basta.media, bfmtv.com, francetvinfo.fr, kaizen-magazine.com, multinationales.org, reuters.com"
"67",67,3,2141.33333333333,0.361923326835608,4.33333333333333,"NA",0,3,0,4,4,0,3,0.75,0.797101449275362,0.797101449275362,"rumble.com, youtube.com, whatsupcanada.org, www.bitchute.com","rumble.com, youtube.com, bitchute.com, whatsupcanada.org"
"68",68,2,3118,0.366666666666667,4,"NA",0,2,0,4,3,7.08333333333333,3,1,0.222222222222222,0.333333333333333,"www.rt.com, www.youtube.com, www.globalresearch.ca, youtube.com","youtube.com, rt.com, globalresearch.ca"
"69",69,2,3137.5,0.396103896103896,4,"NA",0,2,0,4,3,0,2,0.666666666666667,0.2,0.4,"youtube.com, rumble.com, twitter.com, www.youtube.com","youtube.com, rumble.com, twitter.com"
"70",70,2,50459.5,0.408333333333333,4,"NA",0,2,0,4,4,1.25,2,0.5,0.393939393939394,0.393939393939394,"www.facebook.com, youtube.com, sana.sy, thenationalpulse.com","facebook.com, youtube.com, sana.sy, thenationalpulse.com"
"71",71,2,4161.5,0.409090909090909,4,"NA",0,2,0,3,3,0,1,0.333333333333333,0.555555555555555,0.555555555555555,"www.facebook.com, images.app.goo.gl, youtube.com","facebook.com, goo.gl, youtube.com"
"72",72,2,4686,0.324519230769231,4,"NA",0,2,0,8,7,0,2,0.285714285714286,0.476190476190476,0.583333333333333,"www.youtube.com, rumble.com, www.facebook.com, youtube.com, www.cenyrolnicze.pl, vm.tiktok.com, wiadomosci.onet.pl, wprawo.pl","youtube.com, facebook.com, rumble.com, cenyrolnicze.pl, onet.pl, tiktok.com, wprawo.pl"
"73",73,2,4706.5,0.251262626262626,4,"NA",0,2,0,13,12,21.9,8,0.666666666666667,0.287878787878788,0.322314049586777,"youtube.com, healthjusticetees.com, rumble.com, storybysusan.com, vimeo.com, www.foxnews.com, factcheck.afp.com, newspunch.com, thenewamerican.com, thewokeandmail.com, welchequities.com, www.rt.com, www.youtube.com","youtube.com, healthjusticetees.com, foxnews.com, rumble.com, storybysusan.com, vimeo.com, afp.com, newspunch.com, rt.com, thenewamerican.com, thewokeandmail.com, welchequities.com"
"74",74,2,5539.5,0.305555555555556,5,"NA",0,2,0,12,12,34.7058823529412,10,0.833333333333333,0.339712918660287,0.339712918660287,"rumble.com, www.blacklistednews.com, www.judicialwatch.org, dailycaller.com, justthenews.com, secure.anedot.com, www.businessinsider.com, www.dailywire.com, www.micdroppolitics.com, www.ntd.com, www.salon.com, youtube.com","rumble.com, blacklistednews.com, judicialwatch.org, anedot.com, businessinsider.com, dailycaller.com, dailywire.com, justthenews.com, micdroppolitics.com, ntd.com, salon.com, youtube.com"
"75",75,2,29044,0.472222222222222,4,"NA",0,2,0,4,3,7.22222222222222,3,1,0.333333333333333,0.333333333333333,"www.youtube.com, actualidad.rt.com, mundo.sputniknews.com, youtube.com","youtube.com, rt.com, sputniknews.com"
"76",76,2,6053,0.23317435082141,4,"NA",0,2,0,7,6,37.5,6,1,0.366666666666667,0.5,"www.youtube.com, thegrayzone.com, www.politico.eu, youtube.com, www.marketwatch.com, ottawacitizen.com, theintercept.com","youtube.com, thegrayzone.com, politico.eu, marketwatch.com, ottawacitizen.com, theintercept.com"
"77",77,4,57636.25,0.469551282051282,4,"NA",0,4,0,8,7,18.0384615384615,4,0.571428571428571,0.229813664596273,0.347826086956522,"bit.ly, t.me, youtube.com, www.legrandsoir.info, www.youtube.com, abcn.ws, www.instagram.com, www.foxbusiness.com","youtube.com, bit.ly, t.me, legrandsoir.info, abcn.ws, instagram.com, foxbusiness.com"
"78",78,6,113504.5,0.361292335115865,4.8,"NA",0,6,0,17,16,20.5555555555556,7,0.4375,0.5625,0.589247311827957,"lecourrierdesstrateges.fr, youtube.com, lemediaen442.fr, stratpol, www.nytimes.com, www.youtube.com, russiepolitics.blogspot.com, solidariteetprogres.fr, t.me, elcomunista.net, jacquescheminade.fr, lesakerfrancophone.fr, news-antiwar-com.translate.goog, rumble.com, www.instagram.com, www.monde-diplomatique.fr, www.resumenlatinoamericano.org","lecourrierdesstrateges.fr, youtube.com, lemediaen442.fr, NA.NA, nytimes.com, russiepolitics.blogspot.com, solidariteetprogres.fr, t.me, elcomunista.net, instagram.com, jacquescheminade.fr, lesakerfrancophone.fr, monde-diplomatique.fr, resumenlatinoamericano.org, rumble.com, translate.goog"
"79",79,3,3668.33333333333,0.349708262751741,4.5,"NA",0,3,0,9,8,30.9333333333333,3,0.375,0.317307692307692,0.417582417582418,"www.youtube.com, schillerinstitute.nationbuilder.com, factcheck.afp.com, youtube.com, schillerinstitute.com, t.me, twitter.com, www.westernjournal.com, laroucheorganization.com","youtube.com, nationbuilder.com, afp.com, schillerinstitute.com, t.me, twitter.com, westernjournal.com, laroucheorganization.com"
"80",80,2,15540.5,0.403985507246377,4,"NA",0,2,0,5,5,0,1,0.2,0.607142857142857,0.607142857142857,"www.volyn.com.ua, www.change.org, fb.watch, www.siepomaga.pl, youtube.com","volyn.com.ua, change.org, fb.watch, siepomaga.pl, youtube.com"
"81",81,3,9712.33333333333,0.451515151515152,4.5,"FR",3,0,0,5,5,0,1,0.2,0.233333333333333,0.233333333333333,"yes-ukraine.org, t.me, www.vududroit.com, twitter.com, www.ifri.org","yes-ukraine.org, t.me, vududroit.com, ifri.org, twitter.com"
"82",82,2,7315110,0.444444444444444,20,"BR",2,0,0,2,1,NA,0,0,0.8,1,"noticias.uol.com.br, www1.folha.uol.com.br","uol.com.br"
"83",83,2,855,0.24,4,"NA",0,2,0,6,6,13.8333333333333,5,0.833333333333333,0.0909090909090909,0.0909090909090909,"rumble.com, t.me, tkp.at, www.epochtimes.de, www.youtube.com, nypost.com","epochtimes.de, rumble.com, t.me, tkp.at, youtube.com, nypost.com"
"84",84,2,55770.5,0.472222222222222,4,"IT",2,0,0,1,1,0,1,1,1,1,"www.youtube.com","youtube.com"
"85",85,11,7838634.09090909,0.29598718868285,14.0730158730159,"US",11,0,0,7,6,17.6115384615385,3,0.5,0.7925,0.762,"www.theepochtimes.com, www.youtube.com, www.ntd.com, frontpageshow.com, ept.ms, theepochtimes.com, www.ganjingworld.com","theepochtimes.com, youtube.com, ntd.com, frontpageshow.com, ept.ms, ganjingworld.com"
"86",86,3,1861.33333333333,0.296724328303276,6,"NA",0,3,0,9,9,19.7619047619048,5,0.555555555555556,0.360294117647059,0.360294117647059,"histoireetsociete.com, www.youtube.com, www.investigaction.net, lecourrierdesstrateges.fr, www.publico.es, www.lalibre.be, www.legrandsoir.info, www.resumenlatinoamericano.org, www.chroniquepalestine.com","histoireetsociete.com, youtube.com, investigaction.net, lecourrierdesstrateges.fr, publico.es, lalibre.be, legrandsoir.info, resumenlatinoamericano.org, chroniquepalestine.com"
"87",87,2,103584.5,0.419157608695652,6,"BR",2,0,0,2,2,0,1,0.5,0.5,0.5,"www.youtube.com, www.consecratiorussiae.org","youtube.com, consecratiorussiae.org"
"88",88,9,461330,0.482603815937149,4.28835978835979,"PL",9,0,0,2,2,0,1,0.5,0.6,0.6,"goniec.pl, www.youtube.com","goniec.pl, youtube.com"
"89",89,3,325407.333333333,0.193121693121693,4,"UA",2,1,0,7,7,0,1,0.142857142857143,0.444444444444444,0.444444444444444,"fightforua.org, www.youtube.com, t.me, www.findokupant.com, playforukraine.life, www.facebook.com, www.mil.gov.ua","fightforua.org, youtube.com, findokupant.com, t.me, facebook.com, mil.gov.ua, playforukraine.life"
"90",90,2,7964.5,0.354838709677419,8,"NA",0,2,0,6,6,49.8823529411765,5,0.833333333333333,0.327272727272727,0.327272727272727,"www.youtube.com, theeconomiccollapseblog.com, www.dailymail.co.uk, americanmilitarynews.com, www.msn.com, www.reuters.com","youtube.com, theeconomiccollapseblog.com, dailymail.co.uk, americanmilitarynews.com, msn.com, reuters.com"
"91",91,2,10820,0.308333333333333,4,"NA",0,2,0,5,5,0,1,0.2,0.35,0.35,"go.usa.gov, ua.usembassy.gov, www.gov.uk, bit.ly, www.youtube.com","usa.gov, usembassy.gov, www.gov.uk, bit.ly, youtube.com"
"92",92,2,5104,0.343137254901961,6,"AT",2,0,0,5,5,62.0833333333333,5,1,0.166666666666667,0.166666666666667,"www.stern.de, de.rt.com, exxpress.at, www.berliner-zeitung.de, www.youtube.com","stern.de, berliner-zeitung.de, exxpress.at, rt.com, youtube.com"
"93",93,9,284990.777777778,0.423641750692834,5.05674603174603,"CZ",9,0,0,2,2,0,1,0.5,0.901639344262295,0.901639344262295,"cnn.iprima.cz, www.youtube.com","iprima.cz, youtube.com"
"94",94,2,8039,0.2,6,"NA",1,1,0,6,6,10,2,0.333333333333333,0,0,"580896205-the-plundering-nations-last-stand, caitlinjohnstone.substack.com, en.kremlin.ru, sonar21.com, thesaker.is, www.youtube.com","kremlin.ru, NA.NA, sonar21.com, substack.com, thesaker.is, youtube.com"
"95",95,2,1845,0.4125,4,"NA",0,2,0,6,6,0,1,0.166666666666667,0.333333333333333,0.333333333333333,"schillerinstitute.nationbuilder.com, annointedhands.myshopify.com, schillerinstitute.com, vashiva.com, www.youtube.com, www.amazon.com","nationbuilder.com, myshopify.com, schillerinstitute.com, vashiva.com, youtube.com, amazon.com"
"96",96,2,18115,0.425641025641026,4,"NA",0,2,0,5,5,0,2,0.4,0.333333333333333,0.333333333333333,"t.me, www.facebook.com, www.legrandsoir.info, www.youtube.com, pbs.twimg.com","t.me, facebook.com, legrandsoir.info, youtube.com, twimg.com"
"97",97,3,215589,0.259090909090909,4,"BR",3,0,0,4,4,0,1,0.25,0.583333333333333,0.583333333333333,"www.tribunadebrasilia.com.br, www.youtube.com, www.politicaonlinebrasil.com, www.opiniaocritica.com.br","tribunadebrasilia.com.br, youtube.com, politicaonlinebrasil.com, opiniaocritica.com.br"
"98",98,8,2308.375,0.275588971699791,6.53869047619048,"SK",8,0,0,2,2,0,1,0.5,0.963302752293578,0.963302752293578,"sho.sk, www.youtube.com","sho.sk, youtube.com"
"99",99,2,35442,0.403846153846154,4,"NA",0,2,0,2,2,0,1,0.5,0.5,0.5,"www.youtube.com, www.facebook.com","youtube.com, facebook.com"
"100",100,2,15362.5,0.348720800889878,8,"NA",0,2,0,7,7,61.875,2,0.285714285714286,0.26984126984127,0.26984126984127,"abcn.ws, t.me, trib.al, military.binodon24live.com, www.lotuseaters.com, www.philstar.com, www.youtube.com","abcn.ws, t.me, trib.al, binodon24live.com, lotuseaters.com, philstar.com, youtube.com"
"101",101,34,40129.8529411765,0.376312282760093,9.97726490261656,"NA",2,32,0,25,25,81.8,4,0.16,0.893622722400857,0.893622722400857,"infodailyng.com, atlanticpostng.com, dailyexcessive.com, deeruditecommunications.com, bestnewsnet.com, wp.me, www.usip.org, 360glitz.com, congressng.com, www.debka.com, www.eruditegist.com, connectgist.com, hutudole.com, insidebusiness.ng, www.worthynews.com, www.wsj.com, abcn.ws, bit.ly, fxn.ws, musbizu.com.ng, newdiplomatng.com, on.msnbc.com, t.co, unitedafrica.africa, www.facebook.com","infodailyng.com, atlanticpostng.com, dailyexcessive.com, deeruditecommunications.com, bestnewsnet.com, usip.org, wp.me, 360glitz.com, congressng.com, debka.com, eruditegist.com, connectgist.com, hutudole.com, insidebusiness.ng, worthynews.com, wsj.com, abcn.ws, bit.ly, facebook.com, fxn.ws, msnbc.com, musbizu.com.ng, newdiplomatng.com, t.co, unitedafrica.africa"
"102",102,19,440999.526315789,0.192164675609832,11.5019680611786,"US",19,0,0,1,1,82,1,1,1,1,"www.westernjournal.com","westernjournal.com"
"103",103,2,3002754,0.0244629678439642,7,"US",2,0,0,2,2,69.8518518518518,2,1,0.703703703703704,0.703703703703704,"www.westernjournal.com, rumble.com","westernjournal.com, rumble.com"
"104",104,2,24220.5,0.413194444444444,7,"US",2,0,0,5,5,64.9166666666667,4,0.8,0.214285714285714,0.214285714285714,"www.breitbart.com, www.foxbusiness.com, news.sky.com, nypost.com, www.westernjournal.com","breitbart.com, foxbusiness.com, nypost.com, sky.com, westernjournal.com"
"105",105,2,6843.5,0.184811827956989,5,"NA",1,1,0,3,3,41.3,3,1,0.2,0.2,"100percentfedup.com, www.westernjournal.com, www.theepochtimes.com","100percentfedup.com, westernjournal.com, theepochtimes.com"
"106",106,6,7673,0.356302609427609,4,"NA",0,6,0,6,6,83.1742424242424,5,0.833333333333333,0.888235294117647,0.888235294117647,"abcn.ws, www.businessinsider.com, gofund.me, www.aljazeera.com, www.cnn.com, www.westernjournal.com","abcn.ws, businessinsider.com, gofund.me, aljazeera.com, cnn.com, westernjournal.com"
"107",107,2,3584,0.33366935483871,5,"NA",0,2,0,7,7,56.78125,7,1,0.25,0.25,"www.thegatewaypundit.com, americanmilitarynews.com, thepostmillennial.com, www.breitbart.com, www.louderwithcrowder.com, www.westernjournal.com, halturnerradioshow.com","thegatewaypundit.com, americanmilitarynews.com, breitbart.com, louderwithcrowder.com, thepostmillennial.com, westernjournal.com, halturnerradioshow.com"
"108",108,2,3932,0.275210084033613,9,"US",2,0,0,7,7,58.8157894736842,7,1,0.333333333333333,0.333333333333333,"www.westernjournal.com, www.foxnews.com, babylonbee.com, nypost.com, www.americanthinker.com, www.judicialwatch.org, www.dailywire.com","westernjournal.com, foxnews.com, americanthinker.com, babylonbee.com, judicialwatch.org, nypost.com, dailywire.com"
"109",109,2,7359,0.334375,11,"NA",0,2,0,2,2,39.3541666666667,2,1,0.916666666666667,0.916666666666667,"www.thegatewaypundit.com, www.westernjournal.com","thegatewaypundit.com, westernjournal.com"
"110",110,2,2340,0.405844155844156,4,"DE",2,0,0,5,5,71.125,4,0.8,-7.22223729145213e-33,-7.22223729145213e-33,"deutschlandkurier.de, www.berliner-zeitung.de, www.onvista.de, www.welt.de, www1.wdr.de","berliner-zeitung.de, deutschlandkurier.de, onvista.de, wdr.de, welt.de"
"111",111,29,71247.9310344828,0.454723019457035,64.1887078438803,"US",29,0,0,11,11,75.6,9,0.818181818181818,0.844909609895338,0.844909609895338,"townhall.com, hotair.com, apnews.com, pjmedia.com, twitchy.com, www.reuters.com, redstate.com, nypost.com, www.washingtonexaminer.com, letstalkfaith.com, secure.acceptiva.com","townhall.com, hotair.com, apnews.com, pjmedia.com, reuters.com, twitchy.com, redstate.com, nypost.com, washingtonexaminer.com, acceptiva.com, letstalkfaith.com"
"112",112,5,87.6,0.414605672105672,4.66666666666667,"NA",0,5,0,4,4,87.7307692307692,3,0.75,0.358974358974359,0.358974358974359,"www.facebook.com, www.washingtonexaminer.com, nypost.com, www.businessinsider.com","facebook.com, washingtonexaminer.com, businessinsider.com, nypost.com"
"113",113,2,11776,0.26453488372093,12,"NA",1,1,0,7,7,60.5,7,1,0.25,0.25,"www.dailywire.com, thefederalist.com, townhall.com, www.breitbart.com, dailycaller.com, www.foxnews.com, www.washingtonexaminer.com","dailywire.com, breitbart.com, thefederalist.com, townhall.com, dailycaller.com, foxnews.com, washingtonexaminer.com"
"114",114,3,3517.66666666667,0.298911798396334,4.33333333333333,"NA",0,3,0,16,15,71.8333333333333,10,0.666666666666667,0.466666666666667,0.477678571428572,"buff.ly, news.0censor.com, www.facebook.com, www.vox.com, abcn.ws, cousints.com, presidentialwire.com, rumble.com, thepostmillennial.com, video.foxnews.com, www.breitbart.com, www.chicksonright.com, www.dailywire.com, www.foxnews.com, www.npr.org, www.reuters.com","buff.ly, 0censor.com, facebook.com, foxnews.com, vox.com, abcn.ws, breitbart.com, chicksonright.com, cousints.com, dailywire.com, npr.org, presidentialwire.com, reuters.com, rumble.com, thepostmillennial.com"
"115",115,2,949,0.296489563567362,4,"NA",0,2,0,10,10,89.4444444444444,4,0.4,0.333333333333333,0.333333333333333,"basta.media, rapportsdeforce.fr, www.facebook.com, www.francetvinfo.fr, www.vice.com, 2022nda.fr, bit.ly, kaizen-magazine.com, multinationales.org, www.franceinter.fr","basta.media, rapportsdeforce.fr, facebook.com, francetvinfo.fr, vice.com, 2022nda.fr, bit.ly, franceinter.fr, kaizen-magazine.com, multinationales.org"
"116",116,3,164476.666666667,0.466666666666667,4,"FR",3,0,0,4,4,55.6818181818182,2,0.5,0.431372549019608,0.431372549019608,"idrissaberkane.org, www.tf1info.fr, www.upr.fr, livrenoir.fr","idrissaberkane.org, tf1info.fr, upr.fr, livrenoir.fr"
"117",117,2,7008.5,0.403985507246377,5,"NA",0,2,0,9,9,NA,0,0,0.302631578947368,0.302631578947368,"gospodarka.dziennik.pl, www.facebook.com, niezaleznagroup.wordpress.com, warszawa.naszemiasto.pl, wiadomosci.wp.pl, www.tysol.pl, medianarodowe.com, ngopole.pl, niezalezna.pl","dziennik.pl, facebook.com, naszemiasto.pl, tysol.pl, wordpress.com, wp.pl, medianarodowe.com, ngopole.pl, niezalezna.pl"
"118",118,2,1397,0.472222222222222,4,"NA",0,2,0,2,2,NA,0,0,0.5,0.5,"www.thenationalpatriot.com, rspradio1.podbean.com","thenationalpatriot.com, podbean.com"
"119",119,2,1174.5,0.296618357487923,13,"NA",0,2,0,2,2,37.5,1,0.5,0.925925925925926,0.925925925925926,"www.thegatewaypundit.com, vashiva.com","thegatewaypundit.com, vashiva.com"
"120",120,2,4743,0.25047619047619,6,"NA",1,1,0,5,5,59.7857142857143,5,1,0.392857142857143,0.392857142857143,"nypost.com, www.thegatewaypundit.com, www.breitbart.com, www.dailywire.com, justthenews.com","nypost.com, thegatewaypundit.com, breitbart.com, dailywire.com, justthenews.com"
"121",121,2,8736.5,0.236074270557029,6,"US",1,1,0,5,5,54.9230769230769,5,1,0.307692307692308,0.307692307692308,"www.jpost.com, www.theepochtimes.com, thefederalist.com, www.foxbusiness.com, www.realclearinvestigations.com","jpost.com, theepochtimes.com, foxbusiness.com, thefederalist.com, realclearinvestigations.com"
"122",122,22,930047.863636364,0.385130557296472,178.550088456435,"US",20,2,0,6,6,69.5024263431542,6,1,0.998197573656846,0.998197573656846,"www.dailywire.com, justthenews.com, townhall.com, americanmilitarynews.com, www.breitbart.com, www.theblaze.com","dailywire.com, justthenews.com, townhall.com, americanmilitarynews.com, breitbart.com, theblaze.com"
"123",123,2,33952.5,0.369565217391304,7,"KE",2,0,0,6,6,78.2058823529412,6,1,0.411764705882353,0.411764705882353,"www.foxnews.com, www.dailymail.co.uk, www.dailystar.co.uk, www.mirror.co.uk, www.theatlantic.com, www.foxbusiness.com","foxnews.com, dailymail.co.uk, dailystar.co.uk, mirror.co.uk, theatlantic.com, foxbusiness.com"
"124",124,10,172162.5,0.5,27.8666666666667,"IT",10,0,0,1,1,42,1,1,1,1,"www.tg24-ore.com","tg24-ore.com"
"125",125,2,283,0.224974721941355,4,"NA",0,2,0,5,5,27.5,3,0.6,0.175,0.175,"rumble.com, www.blesk.cz, www.telegraph.co.uk, russian.rt.com, www.pokec24.cz","rumble.com, blesk.cz, telegraph.co.uk, pokec24.cz, rt.com"
"126",126,57,67514.9473684211,0.495076520773115,4.28024705256903,"CZ",57,0,0,4,4,NA,0,0,0.929292929292929,0.929292929292929,"tn.nova.cz, www.blesk.cz, cnn.iprima.cz, www.reflex.cz","nova.cz, blesk.cz, iprima.cz, reflex.cz"
"127",127,2,441.5,0.376262626262626,4,"NA",0,2,0,2,2,NA,0,0,0.636363636363636,0.636363636363636,"www.commdiginews.com, www.podomatic.com","commdiginews.com, podomatic.com"
"128",128,2,1350.5,0.303571428571429,5,"NA",0,2,0,4,4,56.25,2,0.5,0.2,0.2,"t.me, m.faz.net, www.compact-online.de, www.moellermachts.info","t.me, compact-online.de, faz.net, moellermachts.info"
"129",129,2,794.5,0.392307692307692,4,"NA",2,0,0,4,4,86.4285714285714,3,0.75,0.333333333333333,0.333333333333333,"www.bfmtv.com, twitter.com, www.lemonde.fr, www.bloomberg.com","bfmtv.com, lemonde.fr, twitter.com, bloomberg.com"
"130",130,2,822877.5,0.372294372294372,16,"BR",2,0,0,1,1,NA,0,0,1,1,"www.jornaldacidadeonline.com.br","jornaldacidadeonline.com.br"
"131",131,2,21934.5,0.244047619047619,4,"NA",0,2,0,5,5,NA,0,0,0.35,0.35,"twitter.com, ssu.gov.ua, www.facebook.com, bit.ly, t.me","twitter.com, facebook.com, ssu.gov.ua, bit.ly, t.me"
